"FilePath","PreprocessedCode"
"/Users/sagelab/Documents/Projects/BugLocalization/Artifact-ICSE24/GUI-Bug-Localization-Data/BuggyProjects/bug-1568/app/src/main/java/io/lerk/lrkFM/activities/file/ContextMenuUtil.java","lerk lrk activity file android app alert dialog android content clip data android content clipboard manager android content context android content intent android net uri android util log android view context menu android widget edit text android widget toast java file java util array list java util object lerk lrk editable pair lerk lrk pref lerk lrk lerk lrk adapter archive array adapter lerk lrk adapter base array adapter lerk lrk operation lerk lrk entity file lerk lrk task archive archive creation task lerk lrk task archive archive parent finder task lerk lrk task operation file delete task lerk lrk task operation file move task lerk lrk task operation file operation task android widget toast length lerk lrk operation copy lerk lrk operation create zip lerk lrk operation extract lerk lrk operation move lerk lrk preference entity always extract current dir lerk lrk preference entity use context toast author lukas luka net context menu util copy move rename delete extract share copy path add zip create zip explore open with string tag context menu util get canonical name file activity activity base array adapter array adapter context menu util file activity activity base array adapter array adapter activity activity array adapter array adapter add menu button context menu param the file param file name the file name the title param menu the context menu fill initialize context menu file string file name context menu menu menu set header title file name add copy path menu menu array adapter archive array adapter those action not available inside archive add extract menu menu add delete menu menu add share menu menu add create zip menu menu add explore menu menu add open with menu menu add copy menu menu add move menu menu add rename menu menu add delete button menu param the file param menu the menu add delete menu file context menu menu menu add delete activity get string string delete set menu item click listener item alert dialog builder activity set title string delete set message activity get string string warn delete msg file activity whitespace get name set negative button string cancel dialog dialog cancel set positive button string yes dialog file delete task activity toast make text activity string err delete element length show execute activity reload current directory dialog dismiss show add extract menu param file file file param menu menu add extract menu file file context menu menu archive parent finder task file parent finder menu add extract activity get string string extract set menu item click listener file archive extract file file archive parent finder archive archive extract parent finder get archive file activity add file context extract archive extract pref use context toast get value toast make text activity activity get string string file add context archive extract get name length show pref always extract current dir get value activity finish file operation alert dialog builder activity set view layout layout extract now prompt set positive button string yes dialog which activity finish file operation set neutral button string yes and remember dialog which pref always extract current dir set value activity finish file operation set negative button string dialog which log tag noop create show activity reload current directory set visible file archive parent finder archive execute add share menu param the file param menu the menu add share menu file context menu menu menu add share activity get string string share set menu item click listener intent intent intent intent action send intent set type file get mime type from file intent put extra intent extra stream uri from file get file activity start activity intent create chooser intent activity get string string share file add rename menu param the file param menu the menu add rename menu file context menu menu menu add rename activity get string string rename set menu item click listener item alert dialog alert dialog array adapter get generic file dialog string rename string rename drawable mode edit black layout layout name prompt file move task activity log tag cancel alert dialog set show listener array adapter preset name dialog alert dialog destination name get name alert dialog show activity reload current directory add move menu param the file param menu the menu add move menu file context menu menu menu add move activity get string string move set menu item click listener item activity add file context move pref use context toast get value toast make text activity activity get string string file add context get name length show activity reload current directory add copy menu param the file param menu the menu add copy menu file context menu menu menu add copy activity get string string copy set menu item click listener item activity add file context copy pref use context toast get value toast make text activity activity get string string file add context get name length show activity reload current directory add copy path menu param the file param menu the menu add copy path menu file context menu menu menu add copy path string copy path set menu item click listener item clipboard manager object require non null activity get system service context clipboard service set primary clip clip data plain text activity get string string file location get file get absolute path add create zip and add zip menu param the file param menu the menu add create zip menu file context menu menu editable pair operation array list file file context activity get file context zip file ready file context get first equal create zip file context get second size menu add add zip zip file ready activity get string string add zip activity get string string zip file set menu item click listener item activity add file context create zip pref use context toast get value toast make text activity activity get string string file add context get name length show activity reload current directory zip file ready menu add create zip activity get string string create zip file set menu item click listener item file context get first equal create zip alert dialog alert dialog array adapter get generic file dialog string create zip file string destination drawable archive black layout layout name prompt string tmp name edit text edit text find view destination name tmp name edit text get text string tmp name empty tmp name start with toast make text activity string err invalid input zip length show tmp name null tmp name end with zip tmp name tmp name zip file destination file activity get current directory tmp name destination exist alert dialog builder builder file operation task get file exist dialog builder activity builder set dismiss listener dialog archive creation task activity file context get second destination success activity clear file cache activity reload current directory success toast make text activity string unable create zip file toast length show execute show archive creation task activity file context get second destination success activity clear file cache activity reload current directory success toast make text activity string unable create zip file toast length show execute log tag cancel alert dialog show activity reload current directory log tag illegal operation mode expect create zip but file context get first set visible file context get first equal create zip add explore menu file context menu menu menu add explore activity get string string explore set menu item click listener item activity load path get absolute path set visible archive add open with menu file context menu menu menu add open with activity get string string open with set menu item click listener item intent intent intent action view string mime type file get mime type from file set data and type uri from file get file mime type set flag intent flag activity task intent chooser intent create chooser activity get string string choose application resolve activity activity get manager null activity get manager query intent activity size toast make text activity string only one app handle file length show activity start activity chooser toast make text activity string app handle file length show set visible directory"
"/Users/sagelab/Documents/Projects/BugLocalization/Artifact-ICSE24/GUI-Bug-Localization-Data/BuggyProjects/bug-1568/app/src/main/java/io/lerk/lrkFM/activities/file/ArchiveParentFinder.java","lerk lrk activity file java file lerk lrk entity archive lerk lrk entity file lerk lrk exception block stuff main thread exception find parent archive author lukas luka net archive parent finder string path archive archive archive file archive parent finder string path path path archive archive archive get archive file archive file archive parent finder invoke block stuff main thread exception archive archive file null string path path equal path path null file file file path archive archive archive file archive file path path file path get parent archive path null path empty"
"/Users/sagelab/Documents/Projects/BugLocalization/Artifact-ICSE24/GUI-Bug-Localization-Data/BuggyProjects/bug-1568/app/src/main/java/io/lerk/lrkFM/activities/file/ArchiveLoader.java","lerk lrk activity file android support annotation non null android support annotation nullable java util array list lerk lrk entity archive lerk lrk entity file use load archive author lukas luka net archive loader extend loader the archive archive archive the path the archive string path constructor param archive file the file load param path the path load archive loader non null archive archive file string path archive archive file path path override array list file load location files load location files path path override array list file load location files path nullable string parent archive get content path parent null parent"
"/Users/sagelab/Documents/Projects/BugLocalization/Artifact-ICSE24/GUI-Bug-Localization-Data/BuggyProjects/bug-1568/app/src/main/java/io/lerk/lrkFM/activities/themed/ThemedAppCompatPreferenceActivity.java","lerk lrk activity theme android app activity android content configuration android bundle android preference preference activity android support annotation layout res android support annotation non null android support app app compat delegate android view menu inflater android view view android view view group link android preference preference activity which implement and proxy the necessary call use with app compat now with theme author lukas luka net theme app compat preference activity extend preference activity app compat delegate delegate inherit doc see theme app compat activity set theme from preferences activity override protect create bundle save instance state theme app compat activity set theme from preferences get delegate install view factory get delegate create save instance state create save instance state override protect post create bundle save instance state post create save instance state get delegate post create save instance state non null override menu inflater get menu inflater get delegate get menu inflater override set content view layout res layout res get delegate set content view layout res override set content view view view get delegate set content view view override set content view view view view group layout param param get delegate set content view view param override add content view view view view group layout param param get delegate add content view view param override protect post resume post resume get delegate post resume override protect title changed sequence title color title changed title color get delegate set title title override configuration changed configuration config configuration changed config get delegate configuration changed config override protect stop stop get delegate stop override protect destroy destroy get delegate destroy invalidate option menu get delegate invalidate option menu app compat delegate get delegate delegate null delegate app compat delegate create null delegate"
"/Users/sagelab/Documents/Projects/BugLocalization/Artifact-ICSE24/GUI-Bug-Localization-Data/BuggyProjects/bug-1568/app/src/main/java/io/lerk/lrkFM/activities/themed/ThemedAppCompatActivity.java","lerk lrk activity theme android app activity android bundle android support annotation nullable android support app app compat activity lerk lrk pref lerk lrk lerk lrk preference entity theme add theme support theme app compat activity extend app compat activity override protect create nullable bundle save instance state create save instance state set theme from preferences read the current theme use link pref and set set theme from preferences activity context string current theme pref string theme get value string val context get string string pref theme value dark current theme equal val context set theme dark style app theme style app theme dark"
"/Users/sagelab/Documents/Projects/BugLocalization/Artifact-ICSE24/GUI-Bug-Localization-Data/BuggyProjects/bug-1568/app/src/main/java/io/lerk/lrkFM/activities/SettingsActivity.java","lerk lrk activity android content intent android content manager android bundle android preference edit text preference android preference preference android preference preference category android preference preference fragment android preference preference group android support annotation nullable android support app alert dialog android support widget toolbar android util log android view layout inflater android view menu item android widget linear layout android widget toast org jraf android alibglitch glitch effect java util hash set java util list lerk lrk pref lerk lrk lerk lrk activity theme theme app compat preference activity lerk lrk preference entity setting setting activity extend theme app compat preference activity override protect create bundle save instance state create save instance state setup action bar override build headers list header target build headers target load header from resource xml pref header target set the link android app action bar the api available setup action bar linear layout root linear layout find view android content get parent get parent get parent toolbar bar toolbar layout inflater from inflate layout toolbar setting root root add view bar insert top bar set navigation click listener finish method stop fragment injection malicious application make sure deny any unknown fragment here protect valid fragment string fragment name preference fragment get name equal fragment name general preference fragment get name equal fragment name preference fragment get name equal fragment name notification preference fragment get name equal fragment name general preference fragment extend preference fragment string tag general preference fragment get canonical name override create bundle save instance state create save instance state add preferences from resource xml preference general set have options menu preference app version find preference app version app version set summary get activity get manager get info get activity get name version name app version set preference click listener preference glitch effect show glitch get activity manager name not found exception log tag unable get app version add preference change listener get preference screen override option item selected menu item item item get item android home start activity intent get activity get application context setting activity option item selected item preference fragment extend preference fragment override create bundle save instance state create save instance state add preferences from resource xml preference set have options menu add preference change listener get preference screen get preference screen find preference theme set preference change listener alert dialog builder get context set title string restart require title set message string restart require message set neutral button string okay dismiss create show pref string preference entity theme set value string value override option item selected menu item item item get item android home start activity intent get activity get application context setting activity option item selected item notification preference fragment extend preference fragment override create bundle save instance state create save instance state add preferences from resource xml preference notification set have options menu add preference change listener get preference screen override option item selected menu item item item get item android home start activity intent get activity get application context setting activity option item selected item add generic link android preference preference preference change listener update the preference general with link pref that recursively every preference contain the supply link preference group what you get when customize too much stuff param preference group the current link preference group add preference change listener preference group preference group preference group get preference count preference preference group get preference preference category add preference change listener preference category set preference change listener actually add the listener call link add preference change listener preference group param the link preference set preference change listener preference set preference change listener preference value preference get key equal filename length integer parse string value value toast make text preference get context string err filename length lower than four toast length show edit text preference preference set text preference entity preference entity preference entity determine key preference get key preference entity null value pref preference entity set value value value string pref string preference entity set value string value value hash set pref hash set preference entity set value hash set value"
"/Users/sagelab/Documents/Projects/BugLocalization/Artifact-ICSE24/GUI-Bug-Localization-Data/BuggyProjects/bug-1568/app/src/main/java/io/lerk/lrkFM/consts/PreferenceEntity.java","lerk lrk android support annotation nullable java util hash set lerk lrk lrk app lerk lrk lerk lrk preference store cloud back lerk lrk preference store local preferences author lukas luka net preference entity locally store the first start the application first start local first start the home directory the application home dir local home dir storage emulate the bookmark can currently edit bookmark edit mode local bookmark deletion the parameter sort file sort file local sort file lrk app get context null lrk app get context get string string pref sortby value namea the backup quota exceed backup quota exceed local backup quota exceed zip file should explorable zips explorable local zip explorable there should notification when there version available update notification local update notification cache multitask current dir cache local current dir cache always show link lerk lrk activity intro activity always show intro local always show intro backed cloud the bookmark bookmark cloud back bookmark hash set always the current folder should add bookmark bookmark current folder cloud back bookmark current folder toast should show directory change show toast cloud back show toast the maximum display length filename filename length cloud back filename length maximum length the header path header path length cloud back header path length lrk app get context null lrk app get context get string string pref header path length toast should show file operation context change use context toast cloud back context toast archive should always extract the current directory always extract current dir cloud back always extract current folder unit use the nav drawer header nav header unit cloud back nav header unit app theme theme cloud back theme vibration some toast vibrate toast cloud back context toast vibrate replace checkbox with menu button show menu button instead checkbox cloud back show menu button instead checkbox the preference key string key the preference storage type see preference store preference store store the type the preference type the value the preference object value constructor param store teh storage type param key the key param value the value preference entity preference store store string key object value key key store store value value type value get getter the key string get key key getter the storage type see preference store preference store get store store getter the type get type type getter the value object get value value nullable preference entity determine key string key preference entity preference preference entity value preference get key equal key preference null"
"/Users/sagelab/Documents/Projects/BugLocalization/Artifact-ICSE24/GUI-Bug-Localization-Data/BuggyProjects/bug-1568/app/src/main/java/io/lerk/lrkFM/consts/Operation.java","lerk lrk android support annotation string res lerk lrk lerk lrk activity file file activity file operations author lukas luka net operation copy string copy move string move extract string extract create zip string zip file none string empty delete string delete title file operation param title may not contain pre pre see file activity prepare options menu operation string res title title title get title title"
"/Users/sagelab/Documents/Projects/BugLocalization/Artifact-ICSE24/GUI-Bug-Localization-Data/BuggyProjects/bug-1568/app/src/main/java/io/lerk/lrkFM/consts/FileType.java","lerk lrk android support annotation nullable android support annotation string res android util log lerk lrk handler lerk lrk lerk lrk entity file file type author lukas luka net file type know archive archive rar string type rar rar archive zip string type zip zip archive tar string type tar tar archive string type archive tgz string type tgz unknown string type unknown string tag file type get name string extension string file extension null handler file handler handler file override handle file file log tag handler extension file type string res nullable string extension extension extension string get extension extension get handle file handler handle file type handler handler file handler string get file extension file extension set file extension string file extension file extension file extension setter file extension that param file extension link file extension file type with extension string file extension set file extension file extension"
"/Users/sagelab/Documents/Projects/BugLocalization/Artifact-ICSE24/GUI-Bug-Localization-Data/BuggyProjects/bug-1568/app/src/main/java/io/lerk/lrkFM/consts/PreferenceStore.java","lerk lrk lerk lrk pref differentiate between storage type author lukas luka net preference store only store locally local local store the cloud cloud back cloud back name the preference general see pref string name constructor param name name the preference general see name preference store string name name name getter name the name the preference general see name string get name name"
"/Users/sagelab/Documents/Projects/BugLocalization/Artifact-ICSE24/GUI-Bug-Localization-Data/BuggyProjects/bug-1568/app/src/main/java/io/lerk/lrkFM/entities/Bookmark.java","lerk lrk entity android view menu item bookmark item author lukas luka net bookmark string path label menu item menu item bookmark string path string label menu item menu item path path label label menu item menu item set path string path path path set label string label label label set menu item menu item menu item menu item menu item string get path path string get label label menu item get menu item menu item"
"/Users/sagelab/Documents/Projects/BugLocalization/Artifact-ICSE24/GUI-Bug-Localization-Data/BuggyProjects/bug-1568/app/src/main/java/io/lerk/lrkFM/entities/HistoryEntry.java","lerk lrk entity android support annotation nullable history entry author lukas luka net history entry archive archive string path archive history entry string path nullable archive archive path path archive archive null archive archive string get path path archive archive nullable archive get archive archive"
