"FilePath","PreprocessedCode"
"/Users/sagelab/Documents/Projects/BugLocalization/Artifact-ICSE24/GUI-Bug-Localization-Data/BuggyProjects/bug-71/app/src/main/java/fr/neamar/kiss/forwarder/ExperienceTweaks.java","neamar kiss forwarder android accessibilityservice accessibility service info android annotation suppress lint android app alert dialog android content context android content intent android content activity info android content service info android build android handler android provider setting android text input type android view gesture detector android view motion event android view view android view accessibility accessibility manager android widget image view java lang reflect invocation target exception java lang reflect method java util list neamar kiss main activity neamar kiss neamar kiss searcher history searcher neamar kiss searcher null searcher neamar kiss searcher searcher neamar kiss util lock accessibility service deal with any setting the user experience set sub screen experience tweak extend forwarder input type that behave the consume ime standard obey soft keyboard auto complete means handle auto completion ourselves then ignore whatever the ime think should display input type standard input type type text input type type text flag auto complete input type type text flag suggestion input type that behave the consume ime swift key visible password field will many non latin and may show unexpected behaviour numerous way input type workaround input type type text variation visible password input type type text flag auto correct runnable display keyboard runnable main activity show keyboard view main empty view gesture detector suppress lint source lock orientation activity experience tweak main activity main activity main activity lock launcher into portrait mode here before initialize the view create make the transition smooth possible pref get force portrait build version sdk build version code jelly bean main activity set requested orientation activity info screen orientation user portrait main activity set requested orientation activity info screen orientation portrait main activity set requested orientation activity info screen orientation user gesture detector main activity gesture detector simple gesture listener override single tap motion event tap disabled display history directly pref get tap pref get history onclick action display history single tap override single tap confirm motion event tap enable wait confirm indeed single tap not tap pref get tap pref get history onclick action display history single tap confirm override tap motion event build version sdk build version code tap pref get tap tap accessibility service enable main activity intent intent intent lock accessibility service action lock null main activity lock accessibility service main activity start service intent alert dialog builder builder alert dialog builder main activity builder set message string enable tap lock builder set positive button android string dialog which intent intent intent setting action accessibility setting intent add flag intent flag activity task main activity start activity intent builder set negative button android string cancel dialog which dialog dismiss alert dialog alert builder create alert show tap override fling motion event motion event velocity velocity direction get get direction get get math direction math direction direction action pref get string gesture down display notification action pref get string gesture display keyboard action string action action display notification display notification drawer display keyboard main activity show keyboard display app main activity viewing search result main activity display kiss bar display history minimalistic mode enable minimalistic mode enable and currently minimalistic mode with result and not look the app list main activity viewing search result main activity search edit text get text string empty main activity list get adapter null main activity list get adapter empty main activity run task history searcher main activity main activity clear button set visibility view visible main activity menu button set visibility view invisible minimalistic mode enable favorite main activity favorite bar set visibility view visible create main empty view main activity find view main empty resume adjust input type activity manifest specify state always hidden window soft input mode the keyboard will hide may want display the set set keyboard start enable display keyboard main activity show keyboard handler post delay display keyboard runnable some weird reason keyboard may hide the system have run multiple time different time see http github com neamar kiss issue handler post delay display keyboard runnable handler post delay display keyboard runnable not use thanks window soft input mode unless come back from kiss setting main activity hide keyboard minimalistic mode enable main empty view set visibility view gone main activity list set vertical scroll bar enable main activity search edit text set hint pref get pref hide circle image view main activity launcher button set image bitmap null image view main activity menu button set image bitmap null touch motion event event forward touch event the gesture detector touch event event window focus changed have focus have focus keyboard start enable main activity show keyboard display kiss bar display minimalistic mode enable favorite display main activity favorite bar set visibility view gone display keyboard start enable display keyboard main activity show keyboard update search records refresh string query query empty minimalistic mode enable main activity run task null searcher main activity help text display not minimalistic mode main empty view set visibility view gone minimalistic mode enable favorite main activity favorite bar set visibility view gone searcher searcher history searcher main activity searcher set refresh refresh main activity run task searcher ensure the keyboard use the right input method adjust input type current input type main activity search edit text get input type require input type suggestions enable require input type input type type text non compliant keyboard require input type input type workaround require input type input type standard current input type require input type main activity search edit text set input type require input type hacky code display notification drawer can and will any android release suppress lint api suppress warning and print stack trace display notification drawer suppress lint wrong constant object sbservice main activity get system service statusbar statusbar manager statusbar manager name android app status bar manager method show status bar build version sdk show status bar statusbar manager get method expand notifications panel show status bar statusbar manager get method expand show status bar invoke sbservice not found exception print stack trace such method exception print stack trace illegal access exception print stack trace invocation target exception print stack trace minimalistic mode enable pref get history hide minimalistic mode enable favorite pref get history hide pref get favorite hide pref get enable favorite bar should force the keyboard not display suggestion swiftkey see http github com neamar kiss issue same flesky http github com neamar kiss issue non compliant keyboard string current keyboard setting secure get string main activity get content resolver setting secure input method lower current keyboard contain swiftkey current keyboard contain flesky should the keyboard display keyboard start enable pref get display keyboard should the keyboard autocomplete and suggest option suggestions enable pref get enable suggestion keyboard allow run accessibility service accessibility service enable context context accessibility manager accessibility manager context get system service context accessibility service null list accessibility service info enable services get enable accessibility service list accessibility service info feedback all mask accessibility service info enable service enable services service info enable service info enable service get resolve info service info enable service info name equal context get name enable service info name equal lock accessibility service get name"
"/Users/sagelab/Documents/Projects/BugLocalization/Artifact-ICSE24/GUI-Bug-Localization-Data/BuggyProjects/bug-71/app/src/main/java/fr/neamar/kiss/forwarder/ForwarderManager.java","neamar kiss forwarder android content intent android view context menu android view menu item android view motion event android view view androidx annotation non null neamar kiss main activity forwarder manager extend forwarder widget widget forwarder live wallpaper live wallpaper forwarder tweaks tweak experience tweak experience tweak favorite favorite forwarder permission permission forwarder oreo shortcuts shortcut forwarder tag menu tag menu notification notification forwarder forwarder manager main activity main activity main activity widget forwarder widget main activity tweak tweaks main activity live wallpaper forwarder live wallpaper main activity experience tweak experience tweak main activity favorite forwarder favorite main activity permission forwarder permission main activity shortcut forwarder oreo shortcuts main activity notification forwarder notification main activity tag menu tag menu main activity create favorite forwarder create widget forwarder create tweak create experience tweak create shortcut forwarder create tag menu create start widget forwarder start resume tweak resume experience tweak resume notification forwarder resume tag menu resume pause notification forwarder pause stop widget forwarder stop activity result request code result code intent datum widget forwarder activity result request code result code datum request permissions result request code non null string permission non null grant result permission forwarder request permissions result request code permission grant result option item selected menu item item widget forwarder option item selected item create context menu context menu menu widget forwarder create context menu menu touch view view motion event event experience tweak touch event live wallpaper forwarder touch view event window focus changed have focus experience tweak window focus changed have focus data set change widget forwarder data set change favorite forwarder data set change update search records refresh string query favorite forwarder update search records query experience tweak update search records refresh query favorite change favorite forwarder favorite change display kiss bar display experience tweak display kiss bar display menu button click view menu button tag menu tag menu enable main activity register popup tag menu show menu menu button"
"/Users/sagelab/Documents/Projects/BugLocalization/Artifact-ICSE24/GUI-Bug-Localization-Data/BuggyProjects/bug-71/app/src/main/java/fr/neamar/kiss/result/ShortcutsResult.java","neamar kiss result android annotation target api android app alert dialog android content component name android content context android content dialog android content intent android content share preferences android content launcher apps android content manager android content manager name not found exception android content resolve info android content shortcut info android graphic bitmap android graphic drawable bitmap drawable android graphic drawable drawable android build android user handle android preference preference manager android view view android view view group android view window manager android widget array adapter android widget image view android widget multi auto complete text view android widget text view android widget toast androidx annotation non null java net uri syntax exception java util collection java util list neamar kiss datum handler neamar kiss kiss application neamar kiss neamar kiss adapter record adapter neamar kiss pojo shortcut pojo neamar kiss list popup neamar kiss util fuzzy score neamar kiss util space tokenizer android content launcher apps shortcut query flag match dynamic android content launcher apps shortcut query flag match manifest android content launcher apps shortcut query flag match pin shortcuts result extend result shortcut pojo shortcut pojo shortcuts result shortcut pojo shortcut pojo shortcut pojo shortcut pojo shortcut pojo non null override suppress warning and print stack trace view display context context view view non null view group parent fuzzy score fuzzy score view null view inflate from context layout item shortcut parent share preferences pref preference manager get shared preferences context text view shortcut name view find view item app name display highlight shortcut pojo normalize name shortcut pojo get name fuzzy score shortcut name context text view tag view view find view item app tag hide tag view tag empty shortcut pojo get tag empty tag view set visibility view gone display highlight shortcut pojo get normalize tag shortcut pojo get tag fuzzy score tag view context pref get tag visible tag view set visibility view visible tag view set visibility view gone image view shortcut icon view find view item shortcut icon image view app icon view find view item app icon retrieve icon shortcut manager manager context get manager drawable app drawable null intent intent intent parse uri shortcut pojo intent urus list resolve info manager query intent activity intent size resolve info main get string name main activity info application info name string activity name main activity info name component name name component name name activity name app drawable context get manager get activity icon name make sense the intent uri oreo shortcut shortcut from activity that remove from install app retrieve app icon app drawable manager get application icon shortcut pojo name manager name not found exception print stack trace name not found exception print stack trace view uri syntax exception print stack trace view pref get icon hide bitmap icon shortcut pojo get icon context icon null bitmap drawable drawable bitmap drawable context get resources icon shortcut icon set image drawable drawable app icon set image drawable app drawable icon shortcut use app icon shortcut icon set image drawable app drawable app icon set image resource android drawable menu send app icon set image drawable null shortcut icon set image drawable null view drawable get drawable context context bitmap drawable context get resources shortcut pojo get icon context override protect launch context context view shortcut pojo oreo shortcut oreo shortcut oreo launch context pre oreo shortcut intent intent intent parse uri shortcut pojo intent urus android build version sdk build version code jelly bean intent set source bound get clip bounds context start activity intent exception application just remove toast make text context string application not find toast length show target api build version code oreo launch context context view launcher apps launcher app launcher apps context get system service context launcher apps service launcher app null only the launcher allow start shortcut launcher app have shortcut host permission toast make text context context get string string shortcut host permission toast length show launcher apps shortcut query query launcher apps shortcut query query set shortcut pojo name query set shortcut collection singleton list shortcut pojo get oreo query set query flag flag match dynamic flag match manifest flag match pin list user handle user handle launcher app get profile find the correct user handle and launch the shortcut user handle user handle user handle list shortcut info shortcut launcher app get shortcuts query user handle shortcut null shortcut size shortcut get enable launcher app start shortcut shortcut get get clip bounds null application remove invalid shortcut shortcut app unmounted card toast make text context string application not find toast length show override list popup build popup menu context context array adapter list popup item adapter record adapter parent view parent view adapter add list popup item context string menu favorite add adapter add list popup item context string menu tag edit adapter add list popup item context string menu remove adapter add list popup item context string menu favorite remove adapter add list popup item context string menu shortcut remove inflate popup menu adapter context override popup menu click handler context context record adapter parent string view parent view string string menu shortcut remove launch uninstall context shortcut pojo also remove item since will uninstalled parent remove result context string menu tag edit launch edit tags dialog context shortcut pojo popup menu click handler context parent string parent view launch edit tags dialog context context shortcut pojo pojo alert dialog builder builder alert dialog builder context builder set title context get resources get string string tag add title create the tag dialog view view inflate context layout tag dialog null multi auto complete text view tag input find view tag input array adapter string adapter array adapter context android layout simple dropdown item line kiss application get application context get data handler get tags handler get all tag array tag input set tokenizer space tokenizer tag input set text shortcut pojo get tag tag input set adapter adapter builder set view builder set positive button android string dialog click listener override click dialog dialog which dialog dismiss refresh tag give app pojo set tag tag input get text string kiss application get application context get data handler get tags handler set tag pojo pojo get tag show toast message string msg context get resources get string string tag confirmation add toast make text context msg toast length show builder set negative button android string cancel dialog click listener override click dialog dialog which dialog cancel alert dialog dialog builder create dialog get window set soft input mode window manager layout param soft input state visible dialog show launch uninstall context context shortcut pojo shortcut pojo datum handler kiss application get application context get data handler null remove shortcut shortcut pojo"
"/Users/sagelab/Documents/Projects/BugLocalization/Artifact-ICSE24/GUI-Bug-Localization-Data/BuggyProjects/bug-71/app/src/main/java/fr/neamar/kiss/result/SearchResult.java","neamar kiss result android app search manager android content activity not found exception android content context android content intent android content share preferences android content manager android graphic porter duff android graphic drawable drawable android net uri android preference preference manager android util log android util pair android view view android view view group android widget array adapter android widget image view android widget text view android widget toast androidx annotation non null java unsupported encoding exception java net url encoder java util collection neamar kiss neamar kiss adapter record adapter neamar kiss pojo search pojo neamar kiss list popup neamar kiss util clipboard utils neamar kiss util fuzzy score search result extend result search pojo search pojo search result search pojo search pojo search pojo search pojo search pojo non null override view display context context view view non null view group parent fuzzy score fuzzy score view null view inflate from context layout item search parent text view search text view find view item search text image view image view find view item search icon have custom icon string text len search pojo type search pojo url query text string format context get string string item visit pojo get name text index pojo get name len pojo get name length image set image resource drawable search pojo type search pojo search query text string format context get string string item search pojo get name search pojo query text index search pojo query len search pojo query length image set image resource drawable search share preferences pref preference manager get shared preferences context hide icon pref get icon hide google search hide icon drawable icon context get manager get application icon com google android googlequicksearchbox image set image drawable icon have custom icon manager name not found exception keep duck duck hide icon drawable icon context get manager get application icon com duckduckgo mobile android image set image drawable icon have custom icon manager name not found exception keep search pojo type search pojo calculator query text search pojo query text index len text length image set image resource drawable function illegal argument exception display highlight text collection singleton list pair len search text context have custom icon image set color filter get theme fill color context porter duff mode src view override launch context context view search pojo type search pojo url query search pojo search query google search intent intent intent intent action web search intent add flag intent flag activity task intent put extra search manager query search pojo query query contain search string context start activity intent activity not found exception google app not find fall back method string query query url encoder encode search pojo query utf unsupported encoding exception query url encoder encode search pojo query string url with query search pojo url replace all query uri uri uri parse url with query intent search intent intent action view uri search add flag intent flag activity task context start activity search android content activity not found exception log search result unable run search url search pojo url search pojo calculator query clipboard utils set clipboard context search pojo query substr search pojo query index toast make text context string copy confirmation toast length show override protect list popup build popup menu context context array adapter list popup item adapter record adapter parent view parent view adapter add list popup item context string share inflate popup menu adapter context override protect popup menu click handler context context record adapter parent string view parent view string string share intent share intent intent share intent set action intent action send share intent put extra intent extra text search pojo query share intent set type text plain share intent add flag intent flag activity task context start activity share intent popup menu click handler context parent string parent view google search search pojo url start with http encrypt google com duck duck search pojo url start with http start duckduckgo com"
