"FilePath","PreprocessedCode"
"/Users/sagelab/Documents/Projects/BugLocalization/Artifact-ICSE24/GUI-Bug-Localization-Data/BuggyProjects/bug-71/app/src/main/java/fr/neamar/kiss/utils/calculator/Tokenizer.java","neamar kiss util calculator java math big decimal java text decimal format java text parse exception java util array deque androidx annotation non null tokenizer token sum token subtract token multiply token divide token exp token unary plus token unary minus token number token parenthesis open token parenthesis close token type big decimal number token type type sum token type subtract token type multiply token type divide token type exp token type unary plus token type unary minus token illegal argument exception wrong constructor type type number null token non null big decimal number type number token number number token parenthesis open type parenthesis open parenthesis open token parenthesis close token number null get precedence type unary plus token unary minus token sum token subtract token multiply token divide token exp token right associative type unary plus token unary minus token sum token subtract token multiply token divide token exp token illegal state exception leave associative right associative result array deque token tokenize string expression array deque token token array deque expression length operator expression token token null operator token empty token peek last type token number token token peek last type token parenthesis close token token token token sum token token token token unary plus token token empty token peek last type token number token token peek last type token parenthesis close token token token token subtract token token token token unary minus token expression length expression token token token exp token token token token multiply token token token token multiply token token token token divide token token token token exp token token token token token number string builder number builder string builder check operator part number operator number builder append operator expression length operator expression check operator part number operator number builder append operator number builder length decimal format decimal format decimal format decimal format get instance decimal format set parse big decimal big decimal number null number big decimal decimal format parse number builder string parse exception result syntactical error token token number token null token add last token result result token check operator part number operator character digit operator operator operator operator operator operator"
"/Users/sagelab/Documents/Projects/BugLocalization/Artifact-ICSE24/GUI-Bug-Localization-Data/BuggyProjects/bug-71/app/src/main/java/fr/neamar/kiss/utils/calculator/ShuntingYard.java","neamar kiss util calculator java util array deque shunt yard result array deque tokenizer token infix postfix array deque tokenizer token infix array deque tokenizer token out queue array deque array deque tokenizer token operator stack array deque tokenizer token token infix token type tokenizer token number token out queue add token tokenizer token unary plus token tokenizer token unary minus token tokenizer token sum token tokenizer token subtract token tokenizer token multiply token tokenizer token divide token tokenizer token exp token operator stack empty operator stack push token operator stack empty prec token get precedence prec operator stack peek get precedence token leave associative prec prec token right associative prec prec out queue add operator stack pop operator stack push token tokenizer token parenthesis open token operator stack push token tokenizer token parenthesis close token operator stack empty result syntactical error until stack pop operator operator stack peek type tokenizer token parenthesis open token out queue add operator stack pop operator stack empty result syntactical error operator stack pop operator stack empty out queue add last operator stack pop result result out queue"
"/Users/sagelab/Documents/Projects/BugLocalization/Artifact-ICSE24/GUI-Bug-Localization-Data/BuggyProjects/bug-71/app/src/main/java/fr/neamar/kiss/utils/calculator/Calculator.java","neamar kiss util calculator android build java math big decimal java math math context java util array deque calculator result big decimal calculate expression array deque tokenizer token expression calculate expression expression arithmetic exception result arithmetical error implement the shunt yard algorithm http wikipedia org wiki shunt yard algorithm result big decimal calculate expression array deque tokenizer token expression arithmetic exception array deque big decimal stack array deque tokenizer token token expression big decimal operand null big decimal operand null token type tokenizer token number token stack push token number tokenizer token unary plus token error expression stack result syntactical error redundant stack push stack pop tokenizer token unary minus token error expression stack result syntactical error stack push stack pop negate tokenizer token sum token error expression stack result syntactical error operand stack pop operand stack pop stack push operand add operand tokenizer token subtract token error expression stack result syntactical error operand stack pop operand stack pop stack push operand subtract operand tokenizer token multiply token error expression stack result syntactical error operand stack pop operand stack pop stack push operand multiply operand tokenizer token divide token error expression stack result syntactical error operand stack pop operand stack pop stack push operand divide operand math context decimal tokenizer token exp token error expression stack result syntactical error operand stack pop operand stack pop pow strict math pow operand value operand value finite pow arithmetic exception not finite result operand string operand string pow stack push big decimal pow stack size result syntactical error result result stack pop error expression unary array deque big decimal stack error unary error error stack size error error stack size error code the argument finite point value code otherwise and infinity argument param the code value test code the argument finite point value code otherwise finite build version sdk build version code finite math max value"
"/Users/sagelab/Documents/Projects/BugLocalization/Artifact-ICSE24/GUI-Bug-Localization-Data/BuggyProjects/bug-71/app/src/main/java/fr/neamar/kiss/utils/calculator/Result.java","neamar kiss util calculator androidx annotation non null result result syntactical error result result arithmetical error result result result non null result result result result syntactical error arithmetical error result syntactical syntactical error syntactical arithmetical error syntactical result null result non null result result result syntactical error arithmetical error"
"/Users/sagelab/Documents/Projects/BugLocalization/Artifact-ICSE24/GUI-Bug-Localization-Data/BuggyProjects/bug-71/app/src/main/java/fr/neamar/kiss/utils/DrawableUtils.java","neamar kiss util android graphic bitmap android graphic canvas android graphic drawable bitmap drawable android graphic drawable drawable androidx annotation non null drawable utils http stackoverflow com question how convert drawable bitmap bitmap drawable bitmap non null drawable drawable bitmap bitmap drawable bitmap drawable bitmap drawable bitmap drawable bitmap drawable drawable bitmap drawable get bitmap null bitmap drawable get bitmap drawable get intrinsic width drawable get intrinsic height bitmap bitmap create bitmap bitmap config argb single color bitmap will create pixel bitmap bitmap create bitmap drawable get intrinsic width drawable get intrinsic height bitmap config argb canvas canvas canvas bitmap drawable set bounds canvas get width canvas get height drawable draw canvas bitmap"
"/Users/sagelab/Documents/Projects/BugLocalization/Artifact-ICSE24/GUI-Bug-Localization-Data/BuggyProjects/bug-71/app/src/main/java/fr/neamar/kiss/utils/SystemUiVisibilityHelper.java","neamar kiss util android content share preferences android build android handler android looper android preference preference manager android util log android view view neamar kiss main activity system visibility helper implement view system visibility change listener main activity main activity handler handler share preferences pref keyboard visible scroll popup count use emulate system flag immersive sticky runnable auto apply system runnable auto apply system auto apply system keyboard visible scroll popup count apply system system visibility helper main activity activity main activity activity handler handler looper get main looper pref preference manager get shared preferences activity view decor view main activity get window get decor view decor view set system visibility change listener keyboard visible scroll popup count window focus changed have focus have focus scroll apply scroll system apply system keyboard visibility change visible keyboard visible visible visible handler remove callbacks auto apply system runnable apply system auto apply system runnable run apply system apply system preference hide nav bar preference hide status bar apply system hide nav bar hide status bar visibility hide nav bar build version sdk build version code kitkat visibility visibility view system flag hide navigation hide nav bar visibility visibility view system flag low profile view system flag hide navigation hide nav bar hide status bar build version sdk build version code jelly bean visibility visibility view system flag fullscreen hide status bar hide nav bar hide status bar build version sdk build version code kitkat visibility visibility view system flag immersive view decor view main activity get window get decor view decor view set system visibility visibility apply scroll system scroll build version sdk build version code kitkat apply system reset scroll scroll keyboard visible handler post auto apply system runnable preference hide nav bar pref get pref hide navbar preference hide status bar pref get pref hide statusbar override system visibility change visibility string builder string builder append string format system visibility change visibility visibility view system flag hide navigation append system flag hide navigation visibility view system flag layout fullscreen append system flag layout fullscreen visibility view system flag fullscreen append system flag fullscreen visibility view system flag immersive append system flag immersive visibility view system flag immersive sticky append system flag immersive sticky log bog string visibility view system flag hide navigation apply system visibility handler post delay auto apply system runnable copy visibility view content view view decor view main activity get window get decor view visibility decor view get system visibility content view set system visibility visibility add popup popup count build version sdk build version code kitkat apply system pop popup popup count popup count log bog popup count negative popup count"
"/Users/sagelab/Documents/Projects/BugLocalization/Artifact-ICSE24/GUI-Bug-Localization-Data/BuggyProjects/bug-71/app/src/main/java/fr/neamar/kiss/utils/FuzzyScore.java","neamar kiss util android util pair java util array list java util list sublime text inspire fuzzy match algorithm http github com forrestthewood lib blob master doc fuzzy match match otw power the wild info info score match otw druid the claw info info score match otw frostwolf grunt info info score fuzzy score pattern length pattern pattern lower bonus all character match useful query should match with higher score than john smith full word bonus bonus adjacent match adjacency bonus bonus match occur after separator separator bonus bonus match uppercase and prev lower camel bonus penalty apply every letter str before the first match lead letter penalty maximum penalty lead letter max lead letter penalty penalty every letter that matter unmatched letter penalty match info match info fuzzy score pattern detailed match indices pattern length pattern length pattern pattern length pattern lower pattern length pattern lower length pattern pattern pattern lower character lower pattern full word bonus adjacency bonus separator bonus camel bonus lead letter penalty max lead letter penalty unmatched letter penalty detailed match indices match info match info pattern length match info match info fuzzy score pattern pattern fuzzy score set full word bonus full word bonus full word bonus full word bonus fuzzy score set adjacency bonus adjacency bonus adjacency bonus adjacency bonus fuzzy score set separator bonus separator bonus separator bonus separator bonus fuzzy score set camel bonus camel bonus camel bonus camel bonus fuzzy score set lead letter penalty lead letter penalty lead letter penalty lead letter penalty fuzzy score set max lead letter penalty max lead letter penalty max lead letter penalty max lead letter penalty fuzzy score set unmatched letter penalty unmatched letter penalty unmatched letter penalty unmatched letter penalty param text string where search each character pattern find sequentially within text match info match sequence text idx idx codepoint text length text length codepoint character code point count text text length idx text length codepoint character code point text idx codepoint idx codepoint codepoint idx character count codepoint idx codepoint match codepoint param text string convert codepoint each character pattern find sequentially within text match info match text loop variable score pattern idx str idx str length text length full word prev match prev lower prev separator first letter match get separator bonus use best match letter multiple string letter match the pattern integer best letter null integer best lower null integer best letter idx null best letter score match info match indices null match info match indices clear loop over string str idx str length integer pattern null integer pattern lower null pattern idx pattern length pattern pattern pattern idx pattern lower pattern lower pattern idx str text str idx str lower character lower str str upper character upper str whitespace character whitespace str next match pattern null pattern lower str lower rematch best letter null best lower str lower advance next match best letter null pattern repeat best letter null pattern null pattern lower equal best lower advance pattern repeat score best letter score match info match indices null match info match indices add best letter idx best letter null best lower null best letter idx null best letter score current separator and have match all the previous character apply the full match bonus whitespace full word score full word bonus next match rematch score apply penalty each letter before the first pattern match note std max because penalty negative value max smallest penalty pattern idx penalty math max str idx lead letter penalty max lead letter penalty score penalty apply bonus consecutive bonus prev match rematch score adjacency bonus apply bonus match after separator prev separator score separator bonus apply bonus across camel boundary include clever letter check prev lower str str upper str lower str upper score camel bonus update pattern index the next pattern letter match next match pattern idx update best letter text which may next letter rematch score best letter score apply penalty now skip letter best letter null score unmatched letter penalty best letter str best lower str lower best letter idx str idx best letter score score prev separator full word prev match score unmatched letter penalty prev match full word include clever letter check prev lower str str lower str lower str upper prev separator whitespace str idx apply score last match best letter null score best letter score match info match indices null match info match indices add best letter idx last word full match bonus full word score full word bonus match info match pattern idx pattern length match info match match info score score match info match info higher better match value have intrinsic mean range vary with pattern can only compare score with same search pattern score match array list integer match indices match info match indices null match info pattern length match indices array list pattern length list pair integer integer get match sequence match indices null compute pair match index list pair integer integer position array list match indices size start match indices get end start match indices size end match indices get end position add pair start end start match indices get end start position add pair start end position"
"/Users/sagelab/Documents/Projects/BugLocalization/Artifact-ICSE24/GUI-Bug-Localization-Data/BuggyProjects/bug-71/app/src/main/java/fr/neamar/kiss/utils/ClipboardUtils.java","neamar kiss util android content clip data android content clipboard manager android content context clipboard utils set clipboard context context string text clipboard manager clipboard android build version sdk android build version code clipboard context get system service clipboard manager clipboard clipboard manager context get system service context clipboard service clip data clip clip data plain text copy text text clipboard set primary clip clip"
"/Users/sagelab/Documents/Projects/BugLocalization/Artifact-ICSE24/GUI-Bug-Localization-Data/BuggyProjects/bug-71/app/src/main/java/fr/neamar/kiss/utils/UserHandle.java","neamar kiss util android annotation target api android build android process wrapper android user handle that work with all android version user handle serial object handle android user handle android and newer user handle null target api build version code jelly bean user handle serial android user handle user android build version sdk build version code jelly bean not provide any multus user support serial handle null user null process user handle equal user easier processing the current user also store null even there multus user support serial handle null store the give user handle serial serial handle user target api build version code jelly bean android user handle get real handle handle null android user handle handle process user handle current user handle null string add user suffix string string base separator handle null base base separator serial suppress warning and print stack trace have string user suffix string string separator serial index string last index separator index string serial text string substr index serial parse serial text number format exception print stack trace serial serial"
"/Users/sagelab/Documents/Projects/BugLocalization/Artifact-ICSE24/GUI-Bug-Localization-Data/BuggyProjects/bug-71/app/src/main/java/fr/neamar/kiss/utils/ViewGroupUtils.java","neamar kiss util android view view android view view group java util array list java util list view group utils list view remove and get direct child view group view group list view result array list view group get child count result add view group get child view group remove all view result add all view view group view group list view view view view view view group add view view"
"/Users/sagelab/Documents/Projects/BugLocalization/Artifact-ICSE24/GUI-Bug-Localization-Data/BuggyProjects/bug-71/app/src/main/java/fr/neamar/kiss/utils/LockAccessibilityService.java","neamar kiss util android accessibilityservice accessibility service android app service android content intent android build android view accessibility accessibility event lock accessibility service extend accessibility service string action lock neamar kiss lock override accessibility event accessibility event event override interrupt override start command intent intent flag start action lock equal intent get action build version sdk build version code perform global action accessibility service global action lock screen service start sticky"
"/Users/sagelab/Documents/Projects/BugLocalization/Artifact-ICSE24/GUI-Bug-Localization-Data/BuggyProjects/bug-71/app/src/main/java/fr/neamar/kiss/utils/ShortcutUtil.java","neamar kiss util android annotation target api android content context android content intent android content share preferences android content application info android content launcher apps android content manager android content shortcut info android graphic bitmap android graphic drawable drawable android build android user manager android preference preference manager android text text utils android util log java array output stream java util array list java util list java util locale neamar kiss helper neamar kiss shortcut record neamar kiss pojo shortcut pojo neamar kiss shortcut save all oreo shortcuts async neamar kiss shortcut save single oreo shortcut async android content launcher apps shortcut query flag match manifest android content launcher apps shortcut query flag match pin shortcut util string tag shortcut util shortcut generate from shortcut name string generate shortcut string shortcut name shortcut pojo scheme shortcut name lower locale root shortcut enable setting and android version higher equal android shortcuts enable context context share preferences pref preference manager get shared preferences context android build version sdk build version code pref get enable shortcut save all oreo shortcut add all shortcut context context save all oreo shortcuts async context execute save single shortcut via pin request target api build version code add shortcut context context intent intent save single oreo shortcut async context intent execute remove all shortcut save the database remove all shortcut context context helper remove all shortcut context all shortcut from all application available the device target api build version code list shortcut info get all shortcut context context get shortcut context null all shortcut give name target api build version code list shortcut info get shortcut context context string name list shortcut info shortcut info list array list user manager manager user manager context get system service context user service launcher apps launcher app launcher apps context get system service context launcher apps service launcher apps shortcut query shortcut query launcher apps shortcut query shortcut query set query flag flag match manifest flag match pin text utils empty name shortcut query set name android user handle profile manager get user profile shortcut info list add all launcher app get shortcuts shortcut query profile shortcut info list create shortcut pojo from shortcut info target api build version code shortcut record create shortcut record context context shortcut info shortcut info include name shortcut record record shortcut record record name shortcut info get record intent urus shortcut pojo oreo prefix shortcut info get launcher apps launcher app launcher apps context get system service context launcher apps service drawable icon drawable launcher app get shortcut icon drawable shortcut info bitmap icon icon drawable null null drawable utils drawable bitmap icon drawable icon null array output stream bao array output stream icon compress bitmap compress format png bao record icon blob bao array string app name get app name from name context shortcut info get shortcut info get label null include name text utils empty app name record name app name shortcut info get label string record name shortcut info get label string shortcut info get label null include name text utils empty app name record name app name shortcut info get label string record name shortcut info get label string log tag invalid shortcut record name ignore null record app name from name string get app name from name context context string packagename manager manager context get manager application info info manager get application info packagename manager get meta data string app name string manager get application label info app name manager name not found exception print stack trace"
